question,choices,question_formatted,answer,scene_id,label,locations
Is the purple sofa located in the living room against the wall in front of the lamp with the patterned pillows occupied or unoccupied?,"['Occupied by a person', 'Occupied by a pet', 'Unoccupied', 'Occupied by a blanket']",Is the purple sofa located in the living room against the wall in front of the lamp with the patterned pillows occupied or unoccupied? A) Occupied by a person B) Occupied by a pet C) Unoccupied D) Occupied by a blanket. Answer:,C,00000-kfPV7w3FaU5,status,"sofa (4): [2.088, 1.6, -2.114]"
Is the purple sofa positioned in the center of the living room covered in cushions or is it bare?,"['Covered in decorative cushions', 'Has a throw blanket over it', 'Empty without any coverings', 'Covered in a sheet']",Is the purple sofa positioned in the center of the living room covered in cushions or is it bare? A) Covered in decorative cushions B) Has a throw blanket over it C) Empty without any coverings D) Covered in a sheet. Answer:,A,00000-kfPV7w3FaU5,status,"sofa (5): [1.316, 1.798, -2.252]"
Is the railing on the staircase leading down to the front door on the right side of the image in good condition or damaged?,"['The railing is completely intact', 'The railing has a few scratches', 'The railing is broken', 'The railing is missing sections.']",Is the railing on the staircase leading down to the front door on the right side of the image in good condition or damaged? A) The railing is completely intact B) The railing has a few scratches C) The railing is broken D) The railing is missing sections.. Answer:,A,00000-kfPV7w3FaU5,status,"stair (6): [2.274, -0.473, -1.828]"
Is the chair located on the left side of the purple sofa in the living room in use or unoccupied?,"['It is being used by someone', 'It is unoccupied', 'It is turned upside down', 'It is pushed against the wall.']",Is the chair located on the left side of the purple sofa in the living room in use or unoccupied? A) It is being used by someone B) It is unoccupied C) It is turned upside down D) It is pushed against the wall.. Answer:,B,00000-kfPV7w3FaU5,status,"chair (7): [3.172, 4.14, -2.379]"
"Is the table in the image, positioned below the overhead view, cluttered with any objects or is it clear of items?","['The table is cluttered with multiple items', 'The table has a single object on it', 'The table is completely clear of any objects', 'The table has some objects but appears mostly tidy.']","Is the table in the image, positioned below the overhead view, cluttered with any objects or is it clear of items? A) The table is cluttered with multiple items B) The table has a single object on it C) The table is completely clear of any objects D) The table has some objects but appears mostly tidy.. Answer:",C. The table is completely clear of any objects.,00000-kfPV7w3FaU5,status,"table (12): [5.114, 4.158, -2.375]"
"Is the radiator located on the far wall of the kitchen, beneath the large window, currently turned on or off?","['On', 'Off', 'Broken', 'Unplugged']","Is the radiator located on the far wall of the kitchen, beneath the large window, currently turned on or off? A) On B) Off C) Broken D) Unplugged. Answer:",answer,00000-kfPV7w3FaU5,status,"radiator (14): [6.561, 1.542, -2.142]"
Is the refrigerator positioned against the wall in the kitchen currently running or not?,"['Running', 'Not running', 'Open', 'Defrosting']",Is the refrigerator positioned against the wall in the kitchen currently running or not? A) Running B) Not running C) Open D) Defrosting. Answer:,A,00000-kfPV7w3FaU5,status,"appliance (16): [7.402, 1.075, -1.576]"
Is the bed positioned against the wall in the bedroom completely made up or is the bedding disheveled?,"['Completely made up', 'Slightly disheveled', 'Messy with blankets on the floor', 'No bedding on the bed']",Is the bed positioned against the wall in the bedroom completely made up or is the bedding disheveled? A) Completely made up B) Slightly disheveled C) Messy with blankets on the floor D) No bedding on the bed. Answer:,B,00000-kfPV7w3FaU5,status,"bed (24): [1.732, 2.181, 0.353]"
Is the blanket on the bed in the bedroom draped neatly over the mattress or is it slightly rumpled? ,"['Neatly draped', 'Slightly rumpled', 'Folded at the foot', 'On the floor']",Is the blanket on the bed in the bedroom draped neatly over the mattress or is it slightly rumpled?  A) Neatly draped B) Slightly rumpled C) Folded at the foot D) On the floor. Answer:,B. Slightly rumpled,00000-kfPV7w3FaU5,status,"bed (25): [1.544, 3.79, 0.653]"
"Is the bed in the bedroom, which is positioned against the wall and has a messy white bedspread, made or unmade?","['Made', 'Unmade', 'Neatly arranged', 'Half made']","Is the bed in the bedroom, which is positioned against the wall and has a messy white bedspread, made or unmade? A) Made B) Unmade C) Neatly arranged D) Half made. Answer:",B,00000-kfPV7w3FaU5,status,"bed (26): [5.881, 3.732, 0.698]"
Is the lamp on the bedside table next to the bed in the bedroom turned on or off?,"['On', 'Off', 'Flickering', 'Not present']",Is the lamp on the bedside table next to the bed in the bedroom turned on or off? A) On B) Off C) Flickering D) Not present. Answer:,D,00000-kfPV7w3FaU5,status,"bed (27): [5.93, 3.216, 0.422]"
Is the white table near the door in the room decorated with any items on top?,"['Yes, it has a vase and a clock', 'No, it is completely empty', 'Yes, it has a stack of books', 'Yes, it has a lamp on it.']","Is the white table near the door in the room decorated with any items on top? A) Yes, it has a vase and a clock B) No, it is completely empty C) Yes, it has a stack of books D) Yes, it has a lamp on it.. Answer:",B,00000-kfPV7w3FaU5,status,"table (29): [6.94, 1.305, 0.42]"
"Is the bed with a wooden frame positioned against the wall in the bedroom made up with a complete set of bedding, including pillows and a comforter, or is it unmade? ","['It is fully made up with pillows and a comforter', 'It has no comforter but has pillows', 'It is completely unmade', 'It has just a fitted sheet with no pillows.']","Is the bed with a wooden frame positioned against the wall in the bedroom made up with a complete set of bedding, including pillows and a comforter, or is it unmade?  A) It is fully made up with pillows and a comforter B) It has no comforter but has pillows C) It is completely unmade D) It has just a fitted sheet with no pillows.. Answer:",A,00001-UVdNNRcVyV1,status,"bed (6): [-16.597, 9.884, 0.67]"
Is the pillow on the bed on the left side of the image resting flat or propped up against the headboard?,"['Flat', 'Propped up', 'Hanging off the edge', 'Missing']",Is the pillow on the bed on the left side of the image resting flat or propped up against the headboard? A) Flat B) Propped up C) Hanging off the edge D) Missing. Answer:,B,00001-UVdNNRcVyV1,status,"bed (7): [-17.872, -2.469, 0.757]"
Is the bedside lamp on the nightstand next to the bed turned on or off?,"['Turned on', 'Turned off', 'Broken', 'Missing']",Is the bedside lamp on the nightstand next to the bed turned on or off? A) Turned on B) Turned off C) Broken D) Missing. Answer:,B,00001-UVdNNRcVyV1,status,"bed (8): [-13.465, -3.207, 0.281]"
"Is the bed positioned against the wall on the left side of the room made up with pillows and covers, or is it unmade?","['It is neatly made with pillows and covers', 'It has only a sheet with no pillows', 'It is completely unmade with no covers', 'It is made up but lacks pillows.']","Is the bed positioned against the wall on the left side of the room made up with pillows and covers, or is it unmade? A) It is neatly made with pillows and covers B) It has only a sheet with no pillows C) It is completely unmade with no covers D) It is made up but lacks pillows.. Answer:",A,00001-UVdNNRcVyV1,status,"bed (9): [-9.897, -4.525, 0.513]"
Is the bed against the wall near the window made up with the sheets neatly arranged or is it messy with sheets thrown around?,"['Neatly arranged', 'Messy', 'Somewhat arranged', 'Completely bare']",Is the bed against the wall near the window made up with the sheets neatly arranged or is it messy with sheets thrown around? A) Neatly arranged B) Messy C) Somewhat arranged D) Completely bare. Answer:,Neatly arranged,00001-UVdNNRcVyV1,status,"bed (10): [-9.565, -2.9, 0.565]"
Is the bed with the wooden frame positioned against the wall in the corner of the room made or unmade?,"['The bed is made with neatly arranged sheets', 'The bed is unmade with sheets tossed around', 'The bed has some pillows placed on it', 'The bed has no sheets at all.']",Is the bed with the wooden frame positioned against the wall in the corner of the room made or unmade? A) The bed is made with neatly arranged sheets B) The bed is unmade with sheets tossed around C) The bed has some pillows placed on it D) The bed has no sheets at all.. Answer:,B,00001-UVdNNRcVyV1,status,"bed (11): [-10.249, -4.777, 0.541]"
"Is the bed with a light-colored blanket resting on it, located in the corner of the room next to the open door, made or unmade?","['Made', 'Unmade', 'Partially made', 'Covered in pillows']","Is the bed with a light-colored blanket resting on it, located in the corner of the room next to the open door, made or unmade? A) Made B) Unmade C) Partially made D) Covered in pillows. Answer:",Unmade,00001-UVdNNRcVyV1,status,"bed (12): [-10.231, -2.697, 0.51]"
"Is the bed in the bedroom, located against the wall with windows, made up neatly or messy with unmade sheets?","['Neatly made', 'Messy with unmade sheets', 'Half-made', 'Completely stripped']","Is the bed in the bedroom, located against the wall with windows, made up neatly or messy with unmade sheets? A) Neatly made B) Messy with unmade sheets C) Half-made D) Completely stripped. Answer:",B. Messy with unmade sheets,00001-UVdNNRcVyV1,status,"bed (13): [-4.088, -4.228, 0.46]"
Is the bed on the right side of the room with a wooden frame and white bedding currently made or unmade?,"['The bed is completely made', 'The bed has clothes on it', 'The bed has unmade sheets', 'The bed is made but has a pillow on the floor.']",Is the bed on the right side of the room with a wooden frame and white bedding currently made or unmade? A) The bed is completely made B) The bed has clothes on it C) The bed has unmade sheets D) The bed is made but has a pillow on the floor.. Answer:,C. The bed has unmade sheets.,00001-UVdNNRcVyV1,status,"bed (14): [-4.362, -4.301, 0.649]"
Is the bed with a white sheet positioned at the center of the room next to the wooden door neatly made or disheveled?,"['Neatly made', 'Disheveled', 'Partially made', 'Folded']",Is the bed with a white sheet positioned at the center of the room next to the wooden door neatly made or disheveled? A) Neatly made B) Disheveled C) Partially made D) Folded. Answer:,A,00001-UVdNNRcVyV1,status,"bed (15): [-3.64, -4.795, 0.525]"
Is the curtain on the window to the left of the white radiator in the room drawn open or closed?,"['Open', 'Closed', 'Half open', 'Torn']",Is the curtain on the window to the left of the white radiator in the room drawn open or closed? A) Open B) Closed C) Half open D) Torn. Answer:,Open,00001-UVdNNRcVyV1,status,"curtain (33): [-14.969, 11.336, 1.274]"
"Is the curtain on the window in the bedroom completely drawn, partially open, or fully open, considering it is next to the bed and lets in natural light? ","['Completely drawn', 'Partially open', 'Fully open', 'Torn']","Is the curtain on the window in the bedroom completely drawn, partially open, or fully open, considering it is next to the bed and lets in natural light?  A) Completely drawn B) Partially open C) Fully open D) Torn. Answer:",B,00001-UVdNNRcVyV1,status,"curtain (34): [-13.813, 9.624, 1.257]"
Is the radiator mounted against the wall near the window in the living room currently turned on or off?,"['It is turned on and pumping heat', 'It is turned off and not heating', 'It is turned on but not functioning', 'It is in the process of being installed.']",Is the radiator mounted against the wall near the window in the living room currently turned on or off? A) It is turned on and pumping heat B) It is turned off and not heating C) It is turned on but not functioning D) It is in the process of being installed.. Answer:,B,00001-UVdNNRcVyV1,status,"radiator (35): [-15.773, 11.401, 0.443]"
Is the washing machine located beside the ironing board and next to the refrigerator currently in operation or idle?,"['It is in operation', 'It is idle', 'It is malfunctioning', 'It is turned off but preparing to start']",Is the washing machine located beside the ironing board and next to the refrigerator currently in operation or idle? A) It is in operation B) It is idle C) It is malfunctioning D) It is turned off but preparing to start. Answer:,B,00001-UVdNNRcVyV1,status,"laundry machine (36): [-17.28, 1.122, 0.415]"
Is the fire extinguisher positioned in the corner of the room next to the electrical outlet in an upright status or is it leaning to the side?,"['It is upright', 'It is leaning to the side', 'It is completely on the ground', 'It is missing from the corner.']",Is the fire extinguisher positioned in the corner of the room next to the electrical outlet in an upright status or is it leaning to the side? A) It is upright B) It is leaning to the side C) It is completely on the ground D) It is missing from the corner.. Answer:,A,00001-UVdNNRcVyV1,status,"fire extinguisher (37): [-14.877, 7.269, 0.275]"
"Are the stairs leading up in the hallway, located directly under the railing and next to the wooden furniture on the right, well-maintained or damaged? ","['Well-maintained', 'Damaged', 'Under construction', 'Covered in carpet']","Are the stairs leading up in the hallway, located directly under the railing and next to the wooden furniture on the right, well-maintained or damaged?  A) Well-maintained B) Damaged C) Under construction D) Covered in carpet. Answer:",B. Damaged,00001-UVdNNRcVyV1,status,"stair (39): [-1.518, 2.565, 0.591]"
Is the table underneath the bed in the bedroom currently empty or are there any items placed on it?,"['The table is empty', 'There are books on the table', 'A lamp is on the table', 'There are clothes on the table']",Is the table underneath the bed in the bedroom currently empty or are there any items placed on it? A) The table is empty B) There are books on the table C) A lamp is on the table D) There are clothes on the table. Answer:,A,00001-UVdNNRcVyV1,status,"table (40): [-10.249, -4.777, 0.541]"
"Is the wooden table in the center of the dining area, covered with a patterned tablecloth, currently set for a meal with dishes and cutlery on it? ","['Yes, it is set with dishes and cutlery', 'No, it is completely bare', 'It has some items but not a full set', 'It is only partially covered.']","Is the wooden table in the center of the dining area, covered with a patterned tablecloth, currently set for a meal with dishes and cutlery on it?  A) Yes, it is set with dishes and cutlery B) No, it is completely bare C) It has some items but not a full set D) It is only partially covered.. Answer:","B. No, it is completely bare.",00001-UVdNNRcVyV1,status,"table (41): [-7.503, 2.644, 0.641]"
Is the wooden coffee table in front of the blue sofa near the window clean or messy?,"['Clean', 'Messy', 'Dusty', 'Wet']",Is the wooden coffee table in front of the blue sofa near the window clean or messy? A) Clean B) Messy C) Dusty D) Wet. Answer:,A,00001-UVdNNRcVyV1,status,"table (42): [-10.966, 2.194, 0.27]"
"Is the dining table in the center of the room, with a patterned tablecloth, currently set with any dishes or cutlery on top?","['Yes, there are several plates and forks on the table', 'No, the table is completely empty', 'There are only napkins on the table', 'Yes, but only one cup is on the table.']","Is the dining table in the center of the room, with a patterned tablecloth, currently set with any dishes or cutlery on top? A) Yes, there are several plates and forks on the table B) No, the table is completely empty C) There are only napkins on the table D) Yes, but only one cup is on the table.. Answer:","B. No, the table is completely empty.",00001-UVdNNRcVyV1,status,"table (43): [-7.17, 2.229, 0.633]"
Is the wooden chair next to the table in the dining area currently occupied or empty?,"['Occupied by a person', 'Empty', 'Occupied by an object', 'Unstable']",Is the wooden chair next to the table in the dining area currently occupied or empty? A) Occupied by a person B) Empty C) Occupied by an object D) Unstable. Answer:,B,00001-UVdNNRcVyV1,status,"chair (44): [-7.387, 1.688, 0.515]"
"Is the chair with the wooden frame that is positioned near the dining table, facing the kitchen, currently occupied or unoccupied?","['Occupied', 'Unoccupied', 'Broken', 'Missing']","Is the chair with the wooden frame that is positioned near the dining table, facing the kitchen, currently occupied or unoccupied? A) Occupied B) Unoccupied C) Broken D) Missing. Answer:",B,00001-UVdNNRcVyV1,status,"chair (45): [-7.421, 1.628, 0.91]"
"Is the wooden chair positioned in front of the dining table, which has a tablecloth and is near the kitchen, occupied or unoccupied?","['Occupied', 'Unoccupied', 'Broken', 'Newly placed']","Is the wooden chair positioned in front of the dining table, which has a tablecloth and is near the kitchen, occupied or unoccupied? A) Occupied B) Unoccupied C) Broken D) Newly placed. Answer:",B,00001-UVdNNRcVyV1,status,"chair (46): [-7.427, 1.652, 0.557]"
Is the black armchair located in the corner of the room next to the wall positioned in an upright posture or is it reclined back?,"['Upright', 'Reclined', 'Tilted forward', 'Flipped over']",Is the black armchair located in the corner of the room next to the wall positioned in an upright posture or is it reclined back? A) Upright B) Reclined C) Tilted forward D) Flipped over. Answer:,B,00001-UVdNNRcVyV1,status,"chair (47): [-9.173, 0.67, 0.501]"
"Is the toilet located in the bathroom, next to the light-colored wall with a dark-colored object near its base, clean or dirty?","['Clean', 'Dirty', 'Slightly dirty', 'Under maintenance']","Is the toilet located in the bathroom, next to the light-colored wall with a dark-colored object near its base, clean or dirty? A) Clean B) Dirty C) Slightly dirty D) Under maintenance. Answer:",answer,00001-UVdNNRcVyV1,status,"toilet (48): [-3.721, 3.755, 0.272]"
Is the table in the kitchen area near the wooden cabinets currently set with any items or is it clear?,"['It has plates and cutlery', 'It is completely clear', 'There are only drinks on the table', 'It has a tablecloth and some decor.']",Is the table in the kitchen area near the wooden cabinets currently set with any items or is it clear? A) It has plates and cutlery B) It is completely clear C) There are only drinks on the table D) It has a tablecloth and some decor.. Answer:,B,00001-UVdNNRcVyV1,status,"table (52): [-16.599, 2.049, 3.561]"
Is the wooden table positioned near the group of chairs in the outdoor setting currently empty or are there items placed on it?,"['The table is completely empty', 'There are drinks on the table', 'The table has decorative fruits on it', 'There are plates and utensils on the table.']",Is the wooden table positioned near the group of chairs in the outdoor setting currently empty or are there items placed on it? A) The table is completely empty B) There are drinks on the table C) The table has decorative fruits on it D) There are plates and utensils on the table.. Answer:,A,00002-FxCkHAfgh7A,status,"table (1): [5.296, -8.532, 0.285]",1
Is the wooden table at the center of the patio surrounded by chairs clean or dirty?,"['Clean', 'Dirty', 'Broken', 'Worn']",Is the wooden table at the center of the patio surrounded by chairs clean or dirty? A) Clean B) Dirty C) Broken D) Worn. Answer:,B. Dirty,00002-FxCkHAfgh7A,status,"table (2): [5.111, -8.614, 0.302]",1
Is the wooden dining table in the center of the room surrounded by chairs set for a meal or is it empty?,"['Set with plates and cutlery', 'Covered with a tablecloth', 'Completely empty', 'With a vase in the center']",Is the wooden dining table in the center of the room surrounded by chairs set for a meal or is it empty? A) Set with plates and cutlery B) Covered with a tablecloth C) Completely empty D) With a vase in the center. Answer:,C. Completely empty,00002-FxCkHAfgh7A,status,"table (3): [8.056, -1.887, 0.529]",1
Is the wooden table located in front of the sofa with the plaid cushion turned upside down or upright?,"['Upside down', 'Upright', 'Lopsided', 'Leaning']",Is the wooden table located in front of the sofa with the plaid cushion turned upside down or upright? A) Upside down B) Upright C) Lopsided D) Leaning. Answer:,B. Upright,00002-FxCkHAfgh7A,status,"table (4): [9.45, -3.65, 0.248]",1
Is the wooden table in the center of the dining area cluttered with any items or is it completely clear?,"['It has plates and glasses on it', 'It has a tablecloth but nothing else', 'It is completely clear', 'It has magazines scattered on it.']",Is the wooden table in the center of the dining area cluttered with any items or is it completely clear? A) It has plates and glasses on it B) It has a tablecloth but nothing else C) It is completely clear D) It has magazines scattered on it.. Answer:,C,00002-FxCkHAfgh7A,status,"table (5): [8.082, -1.275, 0.828]",1
Is the wooden table in the outdoor setting with chairs on either side currently set with any items or is it empty?,"['It is set with plates and cutlery', 'It has a tablecloth but no items', 'It has a vase of flowers', 'It is empty.']",Is the wooden table in the outdoor setting with chairs on either side currently set with any items or is it empty? A) It is set with plates and cutlery B) It has a tablecloth but no items C) It has a vase of flowers D) It is empty.. Answer:,D,00002-FxCkHAfgh7A,status,"table (6): [5.307, -8.605, 0.293]",1
Is the wooden dining table in the center of the room next to the kitchen turned over or upright?,"['Turned over', 'Upside down', 'Upright', 'On its side']",Is the wooden dining table in the center of the room next to the kitchen turned over or upright? A) Turned over B) Upside down C) Upright D) On its side. Answer:,C. Upright,00002-FxCkHAfgh7A,status,"table (7): [8.45, -1.676, 0.427]",1
"Is the wooden dresser in the living room, located against the wall and topped with various decorative items, empty or filled with objects?","['Empty', 'Filled with decorative items', 'Partially filled with clothing', 'Filled with books']","Is the wooden dresser in the living room, located against the wall and topped with various decorative items, empty or filled with objects? A) Empty B) Filled with decorative items C) Partially filled with clothing D) Filled with books. Answer:",B,00002-FxCkHAfgh7A,status,"table (8): [12.689, -2.683, 0.922]",1
Is the wooden chair positioned at the edge of the patio table surrounded by grass and a bush empty or occupied?,"['Empty', 'Occupied by a person', 'Occupied by an object', 'Unoccupied but leaning against the table']",Is the wooden chair positioned at the edge of the patio table surrounded by grass and a bush empty or occupied? A) Empty B) Occupied by a person C) Occupied by an object D) Unoccupied but leaning against the table. Answer:,A. Empty,00002-FxCkHAfgh7A,status,"chair (9): [4.206, -8.614, 0.385]",1
Is the wooden chair to the left of the table in the outdoor setting occupied or unoccupied?,"['Occupied by a person', 'Occupied by an object', 'Unoccupied', 'Hiding behind the table']",Is the wooden chair to the left of the table in the outdoor setting occupied or unoccupied? A) Occupied by a person B) Occupied by an object C) Unoccupied D) Hiding behind the table. Answer:,C,00002-FxCkHAfgh7A,status,"chair (10): [5.056, -9.194, 0.362]",1
Is the wooden chair positioned on the patio beside the glass sliding doors facing the entrance upright or fallen over?,"['Upright', 'Fallen over', 'Missing', 'Broken']",Is the wooden chair positioned on the patio beside the glass sliding doors facing the entrance upright or fallen over? A) Upright B) Fallen over C) Missing D) Broken. Answer:,A,00002-FxCkHAfgh7A,status,"chair (11): [5.054, -7.91, 0.388]",1
Is the wooden chair positioned on the patio next to the sliding doors facing the garden currently occupied or unoccupied?,"['Occupied by a person', 'Unoccupied', 'Occupied by an object', 'Vacant but in use']",Is the wooden chair positioned on the patio next to the sliding doors facing the garden currently occupied or unoccupied? A) Occupied by a person B) Unoccupied C) Occupied by an object D) Vacant but in use. Answer:,B,00002-FxCkHAfgh7A,status,"chair (12): [5.111, -7.896, 0.344]",1
Is the wooden chair located next to the table on the patio in use or unoccupied?,"['In use', 'Unoccupied', 'Broken', 'Covered']",Is the wooden chair located next to the table on the patio in use or unoccupied? A) In use B) Unoccupied C) Broken D) Covered. Answer:,B,00002-FxCkHAfgh7A,status,"chair (13): [6.006, -8.598, 0.355]",1
"Is the wooden chair located in the outdoor area, positioned near the patio door, occupied by a person or left empty?","['Occupied by a person', 'Left empty', 'Stacked with other chairs', 'Broken and unusable']","Is the wooden chair located in the outdoor area, positioned near the patio door, occupied by a person or left empty? A) Occupied by a person B) Left empty C) Stacked with other chairs D) Broken and unusable. Answer:",B. Left empty,00002-FxCkHAfgh7A,status,"chair (14): [5.121, -7.98, 0.343]",1
