question,choices,question_formatted,answer,scene_id,label,locations
Is the wooden chair positioned in front of the large sliding glass door on the patio currently upright or tipped over?,"['Upright', 'Tipped over', 'Broken', 'Leaning against the wall']",Is the wooden chair positioned in front of the large sliding glass door on the patio currently upright or tipped over? A) Upright B) Tipped over C) Broken D) Leaning against the wall. Answer:,A. Upright,00002-FxCkHAfgh7A,status,"chair (15): [4.181, -8.566, 0.592]",1
Is the armchair with a plaid pattern positioned against the wall in the living room currently occupied or unoccupied?,"['occupied by a person', 'unoccupied', 'partially occupied', 'occupied by a pet']",Is the armchair with a plaid pattern positioned against the wall in the living room currently occupied or unoccupied? A) occupied by a person B) unoccupied C) partially occupied D) occupied by a pet. Answer:,B. unoccupied,00002-FxCkHAfgh7A,status,"chair (16): [10.709, -3.722, 0.566]",1
Is the wooden chair situated next to the weathered table in the outdoor area facing towards the entrance door of the house in good condition or damaged?,"['In good condition', 'Damaged', 'Broken', 'Cleaned']",Is the wooden chair situated next to the weathered table in the outdoor area facing towards the entrance door of the house in good condition or damaged? A) In good condition B) Damaged C) Broken D) Cleaned. Answer:,Damaged,00002-FxCkHAfgh7A,status,"chair (17): [6.031, -8.628, 0.351]",1
"Is the wooden chair at the patio table, located just next to the bush, currently in an upright position or turned over? ","['Upright', 'Turned over', 'Broken', 'Missing']","Is the wooden chair at the patio table, located just next to the bush, currently in an upright position or turned over?  A) Upright B) Turned over C) Broken D) Missing. Answer:",A,00002-FxCkHAfgh7A,status,"chair (18): [4.188, -8.563, 0.387]",1
Is the wooden chair near the patio door outside on the grass currently occupied or unoccupied?,"['Occupied by a person', 'Unoccupied with a book on it', 'Unoccupied and facing away from the door', 'Occupied by a bag.']",Is the wooden chair near the patio door outside on the grass currently occupied or unoccupied? A) Occupied by a person B) Unoccupied with a book on it C) Unoccupied and facing away from the door D) Occupied by a bag.. Answer:,C,00002-FxCkHAfgh7A,status,"chair (19): [5.137, -8.013, 0.346]",1
Is the wooden chair positioned at the edge of the patio around the table facing the garden currently occupied or empty?,"['Occupied by a person', 'Empty with no items on it', 'Occupied with items on it', 'Not visible from this angle']",Is the wooden chair positioned at the edge of the patio around the table facing the garden currently occupied or empty? A) Occupied by a person B) Empty with no items on it C) Occupied with items on it D) Not visible from this angle. Answer:,B,00002-FxCkHAfgh7A,status,"chair (20): [5.158, -9.22, 0.357]",1
Is the wooden chair in front of the dining table in the living room pushed in or pulled out?,"['Pushed in', 'Pulled out', 'On its side', 'Stacked on another chair']",Is the wooden chair in front of the dining table in the living room pushed in or pulled out? A) Pushed in B) Pulled out C) On its side D) Stacked on another chair. Answer:,B,00002-FxCkHAfgh7A,status,"chair (23): [8.107, -1.914, 0.526]",1
"Is the chair at the side of the wooden table, positioned on the grassy area in front of the entrance, currently occupied or unoccupied? ","['Occupied by a person', 'Unoccupied', 'Occupied by an object', 'Not visible']","Is the chair at the side of the wooden table, positioned on the grassy area in front of the entrance, currently occupied or unoccupied?  A) Occupied by a person B) Unoccupied C) Occupied by an object D) Not visible. Answer:",B,00002-FxCkHAfgh7A,status,"chair (24): [6.101, -8.642, 0.349]",1
"Is the chair located at the dining table, which is surrounded by other similar upholstered chairs, currently occupied or unoccupied?","['Occupied by a person', 'Unoccupied', 'Occupied by a bag', 'Occupied by a pet']","Is the chair located at the dining table, which is surrounded by other similar upholstered chairs, currently occupied or unoccupied? A) Occupied by a person B) Unoccupied C) Occupied by a bag D) Occupied by a pet. Answer:",B,00002-FxCkHAfgh7A,status,"chair (25): [8.114, -1.994, 0.505]",1
Is the microwave on the countertop next to the refrigerator and under the upper cabinet currently turned on or off?,"['On', 'Off', 'Unplugged', 'Malfunctioning']",Is the microwave on the countertop next to the refrigerator and under the upper cabinet currently turned on or off? A) On B) Off C) Unplugged D) Malfunctioning. Answer:,B,00002-FxCkHAfgh7A,status,"appliance (46): [4.919, -3.577, 1.089]",1
Is the refrigerator located against the wall next to the sink and the door in the kitchen currently running or not running?,"['Running', 'Not running', 'Broken', 'Unplugged']",Is the refrigerator located against the wall next to the sink and the door in the kitchen currently running or not running? A) Running B) Not running C) Broken D) Unplugged. Answer:,A,00002-FxCkHAfgh7A,status,"appliance (47): [4.984, -4.224, 1.001]",1
Is the fridge located next to the kitchen counter turned on or off?,"['On', 'Off', 'Uncertain', 'Not applicable']",Is the fridge located next to the kitchen counter turned on or off? A) On B) Off C) Uncertain D) Not applicable. Answer:,A,00002-FxCkHAfgh7A,status,"fridge (48): [4.984, -4.224, 1.001]",1
Is the potted plant on the left side of the entrance door in the courtyard thriving or wilting?,"['Thriving', 'Wilting', 'Dead', 'Unknown']",Is the potted plant on the left side of the entrance door in the courtyard thriving or wilting? A) Thriving B) Wilting C) Dead D) Unknown. Answer:,Unknown,00002-FxCkHAfgh7A,status,"plant (49): [10.298, -9.752, 0.394]",1
Is the plant in the pot located to the left of the entrance door showing signs of being healthy or wilted?,"['Healthy', 'Wilted', 'Overwatered', 'Dying']",Is the plant in the pot located to the left of the entrance door showing signs of being healthy or wilted? A) Healthy B) Wilted C) Overwatered D) Dying. Answer:,A,00002-FxCkHAfgh7A,status,"plant (50): [12.975, -5.192, 0.968]",1
Is the large green plant in the terracotta pot located beside the wall near the entrance healthy or wilted?,"['Healthy', 'Wilted', 'Dead', 'Covered in dust']",Is the large green plant in the terracotta pot located beside the wall near the entrance healthy or wilted? A) Healthy B) Wilted C) Dead D) Covered in dust. Answer:,A. Healthy,00002-FxCkHAfgh7A,status,"plant (51): [12.488, -6.573, 0.667]",1
Is the clock on the wall above the wooden dining table turned on and functioning properly?,"['Yes, it is displaying the correct time', 'No, it is stopped at a specific time', 'Yes, but it is slightly fast', 'No, it has no power.']","Is the clock on the wall above the wooden dining table turned on and functioning properly? A) Yes, it is displaying the correct time B) No, it is stopped at a specific time C) Yes, but it is slightly fast D) No, it has no power.. Answer:",A,00002-FxCkHAfgh7A,status,"clock (52): [8.07, -0.103, 1.766]",1
Is the sofa with the plaid covering positioned against the wall near the door standing empty or is it occupied by anyone?,"['It is fully occupied by several people', 'It is partially occupied with a few pillows', 'It is completely empty', 'It has a pet sitting on it.']",Is the sofa with the plaid covering positioned against the wall near the door standing empty or is it occupied by anyone? A) It is fully occupied by several people B) It is partially occupied with a few pillows C) It is completely empty D) It has a pet sitting on it.. Answer:,C,00002-FxCkHAfgh7A,status,"sofa (53): [10.754, -3.756, 0.458]",1
Is the wooden chair located under the table to the right of the brightly colored basket turned upright or is it laying on its side?,"['It is turned upright', 'It is laying on its side', 'It is partially pulled out', 'It is missing from the scene.']",Is the wooden chair located under the table to the right of the brightly colored basket turned upright or is it laying on its side? A) It is turned upright B) It is laying on its side C) It is partially pulled out D) It is missing from the scene.. Answer:,A,00002-FxCkHAfgh7A,status,"chair (54): [8.766, -3.305, 3.544]",2
"Is the wooden chair situated in the corner, next to the colorful blanket and the basket, currently positioned upright or is it tilted?","['Upright', 'Tilted', 'Stacked with another chair', 'Removed from the area']","Is the wooden chair situated in the corner, next to the colorful blanket and the basket, currently positioned upright or is it tilted? A) Upright B) Tilted C) Stacked with another chair D) Removed from the area. Answer:",A,00002-FxCkHAfgh7A,status,"chair (55): [8.647, -3.118, 3.536]",2
Is the chair with the plaid upholstery located in the corner of the room next to the window currently occupied or unoccupied?,"['Occupied by a person', 'Unoccupied', 'Occupied by an animal', 'Occupied by personal items']",Is the chair with the plaid upholstery located in the corner of the room next to the window currently occupied or unoccupied? A) Occupied by a person B) Unoccupied C) Occupied by an animal D) Occupied by personal items. Answer:,B,00002-FxCkHAfgh7A,status,"chair (57): [9.362, -5.785, 3.87]",2
Is the small wooden table located beneath the wall-mounted shelf in the entryway clear of any items or clutter on its surface?,"['Yes, it is clear', 'No, there are items on it', 'It is partially clear', 'The status is unknown.']","Is the small wooden table located beneath the wall-mounted shelf in the entryway clear of any items or clutter on its surface? A) Yes, it is clear B) No, there are items on it C) It is partially clear D) The status is unknown.. Answer:",B,00002-FxCkHAfgh7A,status,"table (60): [8.9, -3.344, 3.552]",2
Is the curtain hanging in the doorway between the room and the outside turned open or closed?,"['The curtain is fully open', 'The curtain is partially open', 'The curtain is fully closed', 'The curtain is tangled.']",Is the curtain hanging in the doorway between the room and the outside turned open or closed? A) The curtain is fully open B) The curtain is partially open C) The curtain is fully closed D) The curtain is tangled.. Answer:,B,00002-FxCkHAfgh7A,status,"curtain (64): [5.503, -4.479, 4.301]",2
Is the framed picture hanging on the wall above the furniture positioned near the door properly aligned or crooked?,"['Properly aligned', 'Crooked', 'Not visible', 'Hanging off the wall']",Is the framed picture hanging on the wall above the furniture positioned near the door properly aligned or crooked? A) Properly aligned B) Crooked C) Not visible D) Hanging off the wall. Answer:,B,00002-FxCkHAfgh7A,status,"picture (65): [7.724, 0.12, 4.863]",2
"Is the crib located in the corner with a wall beside it and the door directly across the room containing a wooden frame, currently holding any items or is it empty?","['It is full of toys', 'It contains bedding', 'It is completely empty', 'It is filled with clothes.']","Is the crib located in the corner with a wall beside it and the door directly across the room containing a wooden frame, currently holding any items or is it empty? A) It is full of toys B) It contains bedding C) It is completely empty D) It is filled with clothes.. Answer:",B,00002-FxCkHAfgh7A,status,"bed (68): [11.194, -0.525, 3.822]",2
"Is the blanket on the bed located in the bedroom, which is draped over the edge and is patterned, currently neatly arranged or is it wrinkled and disheveled?","['Neatly arranged', 'Wrinkled and disheveled', 'Hanging off the side', 'Completely off the bed']","Is the blanket on the bed located in the bedroom, which is draped over the edge and is patterned, currently neatly arranged or is it wrinkled and disheveled? A) Neatly arranged B) Wrinkled and disheveled C) Hanging off the side D) Completely off the bed. Answer:",B. Wrinkled and disheveled,00002-FxCkHAfgh7A,status,"bed (69): [9.779, -2.15, 3.609]",2
