question,choices,question_formatted,locations,scene_id,label,floor_id,answers
Is the color of the table warmer than the color of the chair?,"['A. Yes, the table is warmer', 'B. No, the chair is warmer', 'C. They have similar warmth', 'D. The color cannot be determined.']","Is the color of the table warmer than the color of the chair? A) Yes, the table is warmer B) No, the chair is warmer C) They have similar warmth D) The color cannot be determined.. Answer:","table (12): [5.114, 4.158, -2.375]; chair (8): [0.097, 2.106, -2.041]",00000-kfPV7w3FaU5,color,-1,[]
Which object has a darker color: the radiator or the appliance?,"['A. The radiator is darker', 'B. The appliance is darker', 'C. They share the same darkness', 'D. The colors cannot be inferred.']",Which object has a darker color: the radiator or the appliance? A) The radiator is darker B) The appliance is darker C) They share the same darkness D) The colors cannot be inferred.. Answer:,"radiator (14): [6.561, 1.542, -2.142]; appliance (16): [7.402, 1.075, -1.576]",00000-kfPV7w3FaU5,color,-1,D
Do the two sofas have similar color tones when compared to each other?,"['A. Yes, they are quite similar', 'B. No, one is significantly different', 'C. They can be confused for one another', 'D. The tones cannot be compared.']","Do the two sofas have similar color tones when compared to each other? A) Yes, they are quite similar B) No, one is significantly different C) They can be confused for one another D) The tones cannot be compared.. Answer:","sofa (4): [2.088, 1.6, -2.114]; sofa (3): [3.876, 3.434, -2.103]",00000-kfPV7w3FaU5,color,-1,[]
Is the color of the chair lighter than the color of the table?,"['A. Yes, the chair is lighter', 'B. No, the table is lighter', 'C. Their colors are nearly identical', 'D. The colors cannot be compared.']","Is the color of the chair lighter than the color of the table? A) Yes, the chair is lighter B) No, the table is lighter C) Their colors are nearly identical D) The colors cannot be compared.. Answer:","chair (9): [3.797, -0.048, -2.113]; table (13): [6.128, 2.89, -1.949]",00000-kfPV7w3FaU5,color,-1,[]
Is the color of the chair darker than the color of the bed?,"['A. Yes, the chair is darker than the bed', 'B. No, the bed is darker than the chair', 'C. The colors are similar', 'D. The bed is lighter than the chair']","Is the color of the chair darker than the color of the bed? A) Yes, the chair is darker than the bed B) No, the bed is darker than the chair C) The colors are similar D) The bed is lighter than the chair. Answer:","chair (28): [-0.435, 3.218, 0.564]; bed (25): [1.544, 3.79, 0.653]",00000-kfPV7w3FaU5,color,1,[]
Which object is lighter in color: the door or the bed?,"['A. The door is lighter', 'B. The bed is lighter', 'C. Both are identical in color', 'D. The bed and door colors are too similar to determine']",Which object is lighter in color: the door or the bed? A) The door is lighter B) The bed is lighter C) Both are identical in color D) The bed and door colors are too similar to determine. Answer:,"door (19): [3.633, 1.336, 1.036]; bed (27): [5.93, 3.216, 0.422]",00000-kfPV7w3FaU5,color,1,[]
Do the doors have similar color tones when compared to the table?,"['A. Yes, the doors and table have similar tones', 'B. No, the doors are darker than the table', 'C. The table has a warmer tone than the doors', 'D. The doors are lighter than the table']","Do the doors have similar color tones when compared to the table? A) Yes, the doors and table have similar tones B) No, the doors are darker than the table C) The table has a warmer tone than the doors D) The doors are lighter than the table. Answer:","door (21): [5.862, -0.908, 1.022]; table (29): [6.94, 1.305, 0.42]",00000-kfPV7w3FaU5,color,1,[]
Is the color of the radiator more vibrant than the color of the bed?,"['A. Yes, the radiator is more vibrant', 'B. No, the bed is more vibrant', 'C. The colors do not differ much in vibrancy', 'D. They both have the same vibrancy']","Is the color of the radiator more vibrant than the color of the bed? A) Yes, the radiator is more vibrant B) No, the bed is more vibrant C) The colors do not differ much in vibrancy D) They both have the same vibrancy. Answer:","radiator (30): [5.479, 0.401, 0.655]; bed (26): [5.881, 3.732, 0.698]",00000-kfPV7w3FaU5,color,1,[]
